Name,Description,Latitude,Longitude,InfoURL,ImageURL
UCSB,A great university located along the California coast!,34.416929,-119.845991,"https://en.wikipedia.org/wiki/University_of_California, _Santa_Barbara ",http://web.physics.ucsb.edu/~Women/images/ucsb-big.jpg
Marshall's Beach,A gorgeous secluded and scenic beach in the Presidio neighborhood of San Francisco,37.801685,-122.479965,https://www.presidio.gov/places/marshalls-beach,https://www.californiabeaches.com/wp-content/uploads/2014/09/bigs-Marshall-Beach-Golden-Gate-Bridge-At-Sunset-with-unique-clouds-Large-1000x692.jpg
Yosemite Falls,"The highest waterfall at Yosemite national park, with a lengthy but worthwhile hike",37.7566,-119.5969,https://en.wikipedia.org/wiki/Yosemite_Falls,https://www.yosemitehikes.com/images/ns/lower-yosemite-falls-trailhead-710w.jpg
The Metropolitan Museum of Art,"Largest art museum in the US, holds some of the most famous pieces created from around the world ",40.7794,-73.9632,https://en.wikipedia.org/wiki/Metropolitan_Museum_of_Art,http://www.ariah.info/MET@2x.jpg
Lamar Valley,A part of Yellowstone National Park along the Lamar River where large wildlife like elk and bison are often observed ,44.912417,-110.281091,https://en.wikipedia.org/wiki/Lamar_River,https://www.yellowstonepark.com/wp-content/uploads/2020/06/bison-lamar-sunrise_npsjacobwfrank_1600-1024x576.jpg
Ardenwood Farm,"I grew up by this historic farm/ Ohlone village that's now a regional park, they still have the Victorian family home open for tours, all the farm animals available for petting, and a huge congregation of monarch butterflies in the winter",37.55612607,-122.0511034,https://en.wikipedia.org/wiki/Ardenwood_Historic_Farm,https://www.eastbaytimes.com/wp-content/uploads/2017/11/earg1127butterfly02.jpg